{
  "$schema": "https://json-schema.org/draft/2020-12/schema",
  "$id": "https://wemove.com/schemas/ingrid/schemes/geoDatasetBase",
  "definitions": {
    "coupledResources": {
      "type": "array",
      "items": {
        "type": "object",
        "unevaluatedProperties": false,
        "properties": {
          "icon": {
            "type": "string"
          },
          "type": {
            "type": "string"
          },
          "uuid": {
            "type": "string"
          },
          "state": {
            "type": "string"
          },
          "isExternalRef": {
            "type": "boolean"
          }
        }
      }
    },
    "citation": {
      "type": "array",
      "items": {
        "type": "object",
        "unevaluatedProperties": false,
        "properties": {
          "date": {
            "type": "string",
            "format": "date-string"
          },
          "title": {
            "$ref": "../../general.schema.json#/definitions/KeyValue"
          },
          "edition": {
            "type": ["null", "string"]
          }
        }
      }
    },
    "spatialGrid": {
      "type": ["null", "object"],
      "unevaluatedProperties": false,
      "properties": {
        "type": {
          "anyOf": [
            {
              "$ref": "../../general.schema.json#/definitions/KeyValue"
            },
            {
              "type": "null"
            }
          ]
        },
        "axesDimensionProperties": {
          "type": "array",
          "items": {
            "properties": {
              "name": {
                "$ref": "../../general.schema.json#/definitions/KeyValue"
              },
              "size": {
                "type": ["null", "number"]
              },
              "resolution": {
                "type": ["null", "number"]
              }
            }
          }
        },
        "transformationParameterAvailability": {
          "type": "boolean"
        },
        "numberOfDimensions": {
          "type": ["null", "number"]
        },
        "cellGeometry": {
          "anyOf": [
            {
              "$ref": "../../general.schema.json#/definitions/KeyValue"
            },
            {
              "type": "null"
            }
          ]
        },
        "georectified": {
          "type": "object",
          "properties": {
            "checkPointAvailability": {
              "type": "boolean"
            },
            "checkPointDescription": {
              "type": "string"
            },
            "cornerPoints": {
              "type": [
                "null",
                "number"
              ]
            },
            "pointInPixel": {
              "anyOf": [
                {
                  "$ref": "../../general.schema.json#/definitions/KeyValue"
                },
                {
                  "type": "null"
                }
              ]
            }
          }
        },
        "georeferenceable": {
          "type": "object",
          "properties": {
            "orientationParameterAvailability": {
              "type": "boolean"
            },
            "controlPointAvaliability": {
              "type": "boolean"
            }
          }
        }
      }
    },
    "dataQualitySource": {
      "type": "object",
      "properties": {
        "processStep": {
          "type": "object",
          "unevaluatedProperties": false,
          "properties": {
            "description": {
              "type": "array",
              "items": {
                "$ref": "../../general.schema.json#/definitions/KeyValue"
              }
            }
          }
        },
        "descriptions": {
          "type": "array",
          "items": {
            "type": "object",
            "unevaluatedProperties": false,
            "properties": {
              "_type": {
                "type": "string"
              },
              "value": {
                "type": "string"
              },
              "uuidRef": {
                "type": ["null", "string"]
              },
              "url": {
                "type": ["null", "string"]
              },
              "identifier": {
                "type": ["null", "string"]
              },
              "title": {
                "type": ["null", "string"]
              },
              "date": {
                "type": ["null", "string"],
                "format": "date-time"
              },
              "dateType": {
                "anyOf": [
                  {
                    "$ref": "../../general.schema.json#/definitions/KeyValue"
                  },
                  {
                    "type": "null"
                  }
                ]
              }
            }
          }
        }
      }
    },
    "featureDescription": {
      "properties": {
        "citation": {
          "$ref": "#/definitions/citation"
        },
        "featureTypes": {
          "type": "array",
          "items": {
            "$ref": "../../general.schema.json#/definitions/KeyValue"
          }
        }
      }
    },
    "propertiesGeoDataset": {
      "type": "object",
      "properties": {
        "isAdVCompatible": {
          "type": ["null", "boolean"]
        },
        "isHvd": {
          "type": ["null", "boolean"]
        },
        "isOpenData": {
          "type": ["null", "boolean"]
        },
        "isInspireIdentified": {
          "type": ["null", "string"]
        },
        "subType": {
          "anyOf": [
            {
              "$ref": "../../general.schema.json#/definitions/KeyValue"
            },
            {
              "type": "null"
            }
          ]
        },
        "invekos": {
          "type": "object",
          "properties": {
            "type": {
              "$ref": "../../general.schema.json#/definitions/KeyValue"
            }
          }
        }
      }
    }
  },
  "type": "object",
  "properties": {
    "properties": {
      "$ref": "#/definitions/propertiesGeoDataset"
    },
    "identifier": {
      "type": "string"
    },
    "spatialRepresentationType": {
      "type": "array",
      "items": {
        "$ref": "../../general.schema.json#/definitions/KeyValue"
      }
    },
    "vectorSpatialRepresentation": {
      "type": "array",
      "items": {
        "type": "object",
        "unevaluatedProperties": false,
        "properties": {
          "topologyLevel": {
            "anyOf": [
              {
                "$ref": "../../general.schema.json#/definitions/KeyValue"
              },
              {
                "type": "null"
              }
            ]
          },
          "geometricObjectType": {
            "anyOf": [
              {
                "$ref": "../../general.schema.json#/definitions/KeyValue"
              },
              {
                "type": "null"
              }
            ]
          },
          "geometricObjectCount": {
            "type": [
              "null",
              "number"
            ]
          }
        }
      }
    },
    "topicCategories": {
      "type": "array",
      "items": {
        "$ref": "../../general.schema.json#/definitions/KeyValue"
      }
    },
    "_uuid": {
      "type": "string"
    },
    "_type": {
      "const": "InGridGeoDataset"
    },
    "title": {
      "type": "string"
    },
    "description": {
      "type": "string"
    },
    "alternateTitle": {
      "type": ["null", "string"]
    },
    "parentIdentifier": {
      "type": ["null", "string"]
    },
    "pointOfContact": {
      "type": "array",
      "items": {
        "$ref": "../../general.schema.json#/definitions/PointOfContact"
      },
      "minItems": 1
    },
    "publication": {
      "type": "object",
      "additionalProperties": false,
      "properties": {
        "doi": {
          "type": ["null", "string"]
        },
        "generalResourceType": {
          "anyOf": [
            {
              "$ref": "../../general.schema.json#/definitions/KeyValue"
            },
            {
              "type": "null"
            }
          ]
        },
        "resourceType": {
          "anyOf": [
            {
              "$ref": "../../general.schema.json#/definitions/KeyValue"
            },
            {
              "type": "null"
            }
          ]
        }
      }
    },
    "advProductGroups": {
      "$ref": "refs/general.schema.json#/definitions/advProductGroups"
    },
    "themes": {
      "$ref": "refs/general.schema.json#/definitions/themes"
    },
    "spatial": {
      "$ref": "refs/general.schema.json#/definitions/Spatial"
    },
    "temporal": {
      "$ref": "refs/general.schema.json#/definitions/temporal"
    },
    "resolution": {
      "$ref": "refs/general.schema.json#/definitions/resolution"
    },
    "lineage": {
      "type": "object",
      "unevaluatedProperties": false,
      "properties": {
        "statement": {
          "type": "string"
        }
      }
    },
    "qualities": {
      "type": "array",
      "items": {
        "type": "object",
        "unevaluatedProperties": false,
        "properties": {
          "_type": {
            "type": "string"
          },
          "value": {
            "type": ["null", "number"]
          },
          "parameter": {
            "type": ["null", "string"]
          },
          "measureType": {
            "$ref": "../../general.schema.json#/definitions/KeyValue"
          }
        }
      }
    },
    "portrayalCatalogueInfo": {
      "type": "object",
      "unevaluatedProperties": false,
      "properties": {
        "citation": {
          "$ref": "#/definitions/citation"
        }
      }
    },
    "featureCatalogueDescription": {
      "$ref": "#/definitions/featureDescription"
    },
    "extraInfo": {
      "$ref": "refs/general.schema.json#/definitions/extraInfo"
    },
    "metadata": {
      "$ref": "refs/general.schema.json#/definitions/metadata"
    },
    "resource": {
      "$ref": "refs/general.schema.json#/definitions/resource"
    },
    "keywords": {
      "$ref": "refs/general.schema.json#/definitions/keywords"
    },
    "digitalTransferOptions": {
      "$ref": "refs/general.schema.json#/definitions/digitalTransferOptions"
    },
    "distribution": {
      "$ref": "refs/general.schema.json#/definitions/distribution"
    },
    "dataset": {
      "$ref": "refs/general.schema.json#/definitions/dataset"
    },
    "dataQuality": {
      "type": "object",
      "unevaluatedProperties": false,
      "properties": {
        "completenessOmission": {
          "type": "object",
          "unevaluatedProperties": false,
          "properties": {
            "measResult": {
              "type": ["null", "number"]
            }
          }
        }
      }
    },
    "dataQualityInfo": {
      "type": "object",
      "unevaluatedProperties": false,
      "properties": {
        "lineage": {
          "type": "object",
          "unevaluatedProperties": false,
          "properties": {
            "source": {
              "$ref": "#/definitions/dataQualitySource"
            }
          }
        }
      }
    },
    "absoluteExternalPositionalAccuracy": {
      "type": "object",
      "unevaluatedProperties": false,
      "properties": {
        "vertical": {
          "type": ["null", "number"]
        },
        "horizontal": {
          "type": ["null", "number"]
        },
        "griddedDataPositionalAccuracy": {
          "type": ["null", "number"]
        }
      }
    },
    "priorityDatasets": {
      "type": "array",
      "items": {
        "$ref": "../../general.schema.json#/definitions/KeyValue"
      }
    },
    "invekosKeywords": {
      "type": "array",
      "items": {
        "$ref": "../../general.schema.json#/definitions/KeyValue"
      }
    },
    "hvd": {
      "type": ["null", "boolean"]
    },
    "hvdCategories": {
      "type": "array",
      "items": {
        "$ref": "../../general.schema.json#/definitions/KeyValue"
      }
    },
    "spatialScope": {
      "anyOf": [
        {
          "$ref": "../../general.schema.json#/definitions/KeyValue"
        },
        {
          "type": "null"
        }
      ]
    },
    "maintenanceInformation": {
      "$ref": "refs/general.schema.json#/definitions/maintenanceInformation"
    },
    "references": {
      "$ref": "refs/general.schema.json#/definitions/references"
    },
    "graphicOverviews": {
      "$ref": "refs/general.schema.json#/definitions/graphicOverviews"
    },
    "orderInfo": {
      "$ref": "refs/general.schema.json#/definitions/orderInfo"
    },
    "service": {
      "type": "object",
      "unevaluatedProperties": false,
      "properties": {
        "type": {
          "$ref": "../../general.schema.json#/definitions/KeyValue"
        },
        "version": {
          "type": "array",
          "items": {
            "$ref": "../../general.schema.json#/definitions/KeyValue"
          }
        },
        "operations": {
          "type": "array",
          "items": {
            "type": "object",
            "unevaluatedProperties": false,
            "properties": {
              "name": {
                "type": "string"
              },
              "methodCall": {
                "type": "string"
              },
              "description": {
                "type": ["null", "string"]
              }
            }
          }
        },
        "resolution": {
          "$ref": "refs/general.schema.json#/definitions/resolution"
        },
        "explanation": {
          "type": ["null", "string"]
        },
        "couplingType": {
          "anyOf": [
            {
              "$ref": "../../general.schema.json#/definitions/KeyValue"
            },
            {
              "type": "null"
            }
          ]
        },
        "classification": {
          "type": "array",
          "items": {
            "$ref": "../../general.schema.json#/definitions/KeyValue"
          }
        },
        "coupledResources": {
          "$ref": "#/definitions/coupledResources"
        },
        "systemEnvironment": {
          "type": ["null", "string"]
        },
        "hasAccessConstraints": {
          "type": ["null", "boolean"]
        },
        "implementationHistory": {
          "type": ["null", "string"]
        }
      }
    },
    "conformanceResult": {
      "type": "array",
      "items": {
        "type": "object",
        "unevaluatedProperties": false,
        "properties": {
          "pass": {
            "$ref": "../../general.schema.json#/definitions/KeyValue"
          },
          "isInspire": {
            "type": ["null", "boolean"]
          },
          "explanation": {
            "type": ["null", "string"]
          },
          "specification": {
            "$ref": "../../general.schema.json#/definitions/KeyValue"
          },
          "publicationDate": {
            "type": "string"
          }
        }
      }
    },
    "gridSpatialRepresentation": {
      "$ref": "#/definitions/spatialGrid"
    },
    "openDataCategories": {
      "type": "array",
      "items": {
        "$ref": "../../general.schema.json#/definitions/KeyValue"
      }
    },
    "fileReferences": {
      "type": "array",
      "items": {
        "$ref": "../../general.schema.json#/definitions/FileReference"
      }
    }
  },
  "required": [
    "_uuid",
    "_type",
    "title",
    "topicCategories",
    "lineage",
    "description",
    "pointOfContact",
    "spatial",
    "temporal",
    "metadata",
    "dataset",
    "resource"
  ],
  "title": "GeoDataset"
}
