{
  "_uuid": "5369ad60-938f-4325-b041-25dacfc14709",
  "title": "geodataset-test",
  "_type": "InGridGeoDataset",
  "properties": {
    "isOpenData": false,
    "isAdVCompatible": true,
    "subType": { "key": "5" }
  },
  "openDataCategories": [
    {
      "key": "9",
      "value": "Bevölkerung und Gesellschaft",
      "_codelistId": "6400"
    }
  ],
  "themes": [{ "key": "317" }],
  "dataset": { "languages": ["134"] },
  "lineage": { "statement": "basis" },
  "spatial": {
    "references": [
      {
        "type": "free",
        "title": "Linda, Neustadt an der Orla, Saale-Orla-Kreis, Thüringen, Deutschland (administrative)",
        "value": {
          "lat1": 50.6638647,
          "lat2": 50.7090902,
          "lon1": 11.7449969,
          "lon2": 11.8477633
        }
      },
      {
        "type": "free",
        "ars": "1389283743"
      }
    ],
    "description": "erlaeuterung",
    "spatialSystems": [{ "key": "9000005" }],
    "verticalExtent": {
      "spatialSystem": { "key": "900005" },
      "maximumValue": 6,
      "minimumValue": 7,
      "unitOfMeasure": { "key": "4" }
    }
  },
  "keywords": {
    "free": [{ "label": "optional" }]
  },
  "metadata": { "language": { "key": "103" }, "characterSet": null },
  "resource": {
    "purpose": "production purpose",
    "specificUsage": "aptitude/use",
    "useLimitation": "use constraints",
    "useConstraints": [
      { "title": { "key": "17" }, "source": "terms of use source" }
    ],
    "accessConstraints": [{ "key": "6" }]
  },
  "temporal": {
    "event": {
      "lastModified": "2022-01-12T23:00:00.000Z"
    },
    "status": { "key": "2" },
    "data": {
      "type": "range",
      "resourceDate": "2020-09-03T22:00:00.000Z",
      "intervalFrom": "date",
      "intervalTo": "not-available"
    }
  },
  "extraInfo": { "legalBasicsDescriptions": [{ "key": "59" }] },
  "orderInfo": "bestellinfo",
  "qualities": [
    {
      "_type": "domainConsistency",
      "value": 2,
      "parameter": "param",
      "measureType": { "key": "1" }
    }
  ],
  "identifier": "identifier of data source",
  "references": [
    {
      "url": "data-download.com",
      "referenceType": "url",
      "type": { "key": "9990" },
      "title": "data download",
      "explanation": "more-info"
    }
  ],
  "resolution": [{ "denominator": 4, "distanceDPI": 1, "distanceMeter": 6 }],
  "dataQuality": { "completenessOmission": { "measResult": 55 } },
  "description": "description",
  "distribution": {},
  "spatialScope": { "key": "885989663" },
  "alternateTitle": "short description",
  "pointOfContact": [
    { "ref": "83f92167-6606-4182-948c-5747ad608b80", "type": { "key": "11" } },
    { "ref": "dcf24d5c-7a33-4ffa-8f27-5f47af964a73", "type": { "key": "7" } }
  ],
  "dataQualityInfo": {
    "lineage": {
      "source": {
        "processStep": {
          "description": [
            {
              "key": null,
              "value": "production process"
            }
          ]
        },
        "descriptions": [
          {
            "_type": "freeDescription",
            "value": "Ein freier Beschreibungstext"
          },
          {
            "_type": "freeDescription",
            "value": "Beschreibungstext",
            "identifier": "https://registry.gdi-de.org/id/ogctestcatalog/e8f0fcbb-3583-4848-9782-d2e89dcba887",
            "title": "Titel von Referenz",
            "date": "2024-09-02T22:00:00.000Z",
            "dateType": {
              "key": "2"
            }
          },
          {
            "_type": "internalDataOrigin",
            "value": "Lokale interne Referenz",
            "uuidRef": "4915275a-733a-47cd-b1a6-1a3f1e976948",
            "date": "2025-02-26T23:00:00.000Z",
            "dateType": {
              "key": "3"
            }
          }
        ]
      }
    }
  },
  "topicCategories": [{ "key": "2" }],
  "advProductGroups": [{ "key": "13" }],
  "graphicOverviews": [
    {
      "title": "first_archived",
      "fileName": {
        "uri": "first_archived.txt",
        "value": "first_archived.txt",
        "asLink": false
      }
    }
  ],
  "parentIdentifier": "identifier",
  "priorityDatasets": [{ "key": "-79614265" }],
  "conformanceResult": [
    {
      "pass": { "key": "1" },
      "isInspire": true,
      "explanation": "etwas",
      "specification": { "key": "11" },
      "publicationDate": "2009-12-15"
    }
  ],
  "digitalTransferOptions": [
    {
      "name": { "key": "900006" },
      "mediumNote": "speicherort",
      "transferSize": { "value": 100, "unit": { "key": "MB" } }
    }
  ],
  "maintenanceInformation": {
    "description": "mehr erläuterungen",
    "maintenanceAndUpdateFrequency": { "key": "1" },
    "userDefinedMaintenanceFrequency": { "unit": { "key": "6" }, "number": 6 }
  },
  "portrayalCatalogueInfo": {
    "citation": [
      {
        "date": "2021-10-06T22:00:00.000Z",
        "title": { "key": "1" },
        "edition": "6"
      }
    ]
  },
  "spatialRepresentationType": [{ "key": "1" }],
  "featureCatalogueDescription": {
    "citation": [
      {
        "date": "2022-04-06T22:00:00.000Z",
        "title": { "key": "1" },
        "edition": "9"
      }
    ],
    "featureTypes": [{ "key": null, "value": "attribute info" }]
  },
  "vectorSpatialRepresentation": [
    {
      "topologyLevel": { "key": "4" },
      "geometricObjectType": { "key": "6" },
      "geometricObjectCount": 2
    }
  ],
  "absoluteExternalPositionalAccuracy": { "vertical": 5, "horizontal": 3 },
  "publication": {
    "doi": "10.1000/1234",
    "generalResourceType": { "key": "5" },
    "resourceType": { "key": "2" }
  }
}
